维度,定义,关键词
analysis,分析学生的知识/能力现状、学习兴趣、生活背景、专注力等，以明确课程对象，设计符合学生水平、与国家课程标准要求一致、激发学生兴趣的课程。,知识过载、能力不足、接受度、安全问题、范围+广、学生+接受、授课对象、太难、年级+教材、年级+合适、年级+复杂、合不合适、学生+不适合、压力+大、危险系数、减负、过于复杂、分散+注意力、学生+会用、学生+难度、学生+无法消化、意外伤害、考虑+具体情况、知识量+大、课程难度、好奇心、感兴趣、考虑+班
objective,设计符合国家课程标准的多学科知识、技能、态度目标，在学习目标的指导下设计教学内容、学习活动和学习评价。,学科核心问题、课程目标、课程+标准、学科+标准、学习标准、学段+目标、学生+学会、要求+掌握、运用+理念、培养+兴趣、培养+能力、产生+兴趣、掌握+技巧、掌握+技能、形成+意识、具备+素养、解决问题+能力、目标、生活+联系、最终成果、运用+标准、科学/技术/工程/数学+标准、课程+要求
context,结合学生实际生活体验、设计体现真实世界挑战的学习情境，吸引学生参与。,学习驱动问题、情境、情景、兴趣、工程师、真实+问题，学生+设想+自己、
knowledge,科学选择、整合学科知识内容，分析知识内容的重难点。,知识点、知识量、原理、概念、理论、数学、计算、知识内容、圆、周长、面积、摩擦力长宽高、比例速度、圆周率、直径、半径、学科、因素、参数、授课内容、教学重点、学科+整合、内容+整合、结论
activity,设计指向学习目标、激发学生学习兴趣和潜能的学习活动；系统组织学习内容，科学安排活动顺序，选择合适的教学手段，以促进学生参与，体现学生自我建构或社会建构的导向。,实验、单元环节、知识+教学、模拟、步骤、实际操作、探究、探索、自行+学习/选修，讲/解释+原理/概念/知识点、讨论、讨论+任务、通过讨论、比较异同点、数据分析、学科+顺序、捋+环节、分组、导入、提出问题、迭代+完善、老师+引导、猜想+假设、流程、展示汇报、学习过程、问题+分解、框架、案例、准备阶段、知识+引入、学生+活动、先+然后、测试、边讲+边、边做+边、带+历史博物馆、资料+查询、课前预习、干预、角色扮演、
technology,选择、运用合适的技术支持教学；设计需要借助技术解决的问题，培养学生的信息技术素养。,平台、制作工具、3D打印、手工、工具、尺子、圆规、锤、锯、纸板、模拟、软件、信息技术、展示+手段、制作+方式、制作+手段、多媒体、互联网、计算机
evaluation,设计与学习目标一致，基于学习证据，评价标准清晰，评价方式多样的学习评价。,学习评估、作业+反馈、形成性评价、总结性评价、是否掌握、书面作业、反馈+形式、评+学习过程/学习结果、学习证据、课堂提问、小测、提交+报告、评价准则、量规、好中差、知识+标准、态度+标准、养成+习惯、形成+态度、具备+素养、测试、课堂表现、报告质量、分数、考量、衡量、学生互评、等级
